product_page_url|universal_product_code|title|price_including_tax|price_excluding_tax|number_available|product_description|category|review_rating|image_url
http://books.toscrape.com/catalogue/tipping-the-velvet_999/index.html|90fa61229261140a|Tipping the Velvet|53.74|53.74|20|"""Erotic and absorbing...Written with starling power.""--""The New York Times Book Review "" Nan King, an oyster girl, is captivated by the music hall phenomenon Kitty Butler, a male impersonator extraordinaire treading the boards in Canterbury. Through a friend at the box office, Nan manages to visit all her shows and finally meet her heroine. Soon after, she becomes Kitty's ""Erotic and absorbing...Written with starling power.""--""The New York Times Book Review "" Nan King, an oyster girl, is captivated by the music hall phenomenon Kitty Butler, a male impersonator extraordinaire treading the boards in Canterbury. Through a friend at the box office, Nan manages to visit all her shows and finally meet her heroine. Soon after, she becomes Kitty's dresser and the two head for the bright lights of Leicester Square where they begin a glittering career as music-hall stars in an all-singing and dancing double act. At the same time, behind closed doors, they admit their attraction to each other and their affair begins. ...more"|Historical Fiction|0|http://books.toscrape.com/media/cache/08/e9/08e94f3731d7d6b760dfbfbc02ca5c62.jpg
http://books.toscrape.com/catalogue/forever-and-forever-the-courtship-of-henry-longfellow-and-fanny-appleton_894/index.html|9beb96a2300109d7|Forever and Forever: The Courtship of Henry Longfellow and Fanny Appleton|29.69|29.69|16|"A Proper Historical Romance seriesThe first book in a new series which will focus on the lives of real historical figures who have intriguing stories of courtship that are recreated in fictionalized accounts based on real biographical and social history research.""A well-researched, emotionally charged tale. A love story...fit for the ages."" -Publishers Weekly.It's 1836, an A Proper Historical Romance seriesThe first book in a new series which will focus on the lives of real historical figures who have intriguing stories of courtship that are recreated in fictionalized accounts based on real biographical and social history research.""A well-researched, emotionally charged tale. A love story...fit for the ages."" -Publishers Weekly.It's 1836, and nineteen-year-old Fanny Appleton, a privileged daughter of a wealthy, upper-class Boston industrialist, is touring Europe with her family. Like many girls of her day, she enjoys the fine clothes, food, and company of the elite social circles. But unlike her peers, Fanny is also drawn to education, literature, and more intellectual pursuits.Published author and poet Henry Wadsworth Longfellow is also touring Europe, but under much different circumstances. Widowed while on tour, he has stayed in order to gather credentials that he hopes will secure his professorship at Harvard College. When Henry meets Fanny, he sees in her a kindred spirit, a lover of language and literature and high ideals. He is in love. Fanny, however, is uncertain. He is ten years older than she is, and from a much lower social class. How could such a relationship ever thrive?Could a book of Henry’s poetry, personally delivered, persuade Fanny to believe in a love that lasts forever and forever? ...more"|Historical Fiction|0|http://books.toscrape.com/media/cache/f9/9e/f99e760b894d10c6e5ed578618918367.jpg
http://books.toscrape.com/catalogue/a-flight-of-arrows-the-pathfinders-2_876/index.html|3a6fb983e2554023|A Flight of Arrows (The Pathfinders #2)|55.53|55.53|16|October 1776--August 1777It is said that what a man sows he will reap--and for such a harvest there is no set season. No one connected to Reginald Aubrey is untouched by the crime he committed twenty years ago. Not William, the Oneida child Reginald stole and raised as his own. Identity shattered, enlisted in the British army, William trains with Loyalist refugees eager to October 1776--August 1777It is said that what a man sows he will reap--and for such a harvest there is no set season. No one connected to Reginald Aubrey is untouched by the crime he committed twenty years ago. Not William, the Oneida child Reginald stole and raised as his own. Identity shattered, enlisted in the British army, William trains with Loyalist refugees eager to annihilate the rebels who forced them into exile. Coming to terms with who and what he is proves impossible, but if he breaks his Loyalist oath, he'll be no better than the man who constructed his life of lies.Not Anna, Reginald's adopted daughter, nor Two Hawks, William's twin, both who long for Reginald to accept their love despite the challenges they will face, building a marriage that bridges two cultures. Not Good Voice and Stone Thrower, freed of bitterness by a courageous act of forgiveness, but still yearning for their firstborn son and fearful for the future of their Oneida people.As the British prepare to attack frontier New York and Patriot regiments rally to defend it, two families separated by culture, united by love, will do all in their power to reclaim the son marching toward them in the ranks of their enemies. ...more|Historical Fiction|0|http://books.toscrape.com/media/cache/ec/65/ec651ed66822d4b68938afa645b1ece2.jpg
http://books.toscrape.com/catalogue/the-house-by-the-lake_846/index.html|9287e238d7c3b06e|The House by the Lake|36.95|36.95|15|Anna is content with her well-ordered life in San Francisco. But her world is turned upside down when her beloved grandfather, Max, reveals a startling secret: Anna is part of an aristocratic family who lost everything during World War II. What’s more, Max was forced to leave behind a precious item over seventy years ago in their estate in old Prussia. It’s now his ardent Anna is content with her well-ordered life in San Francisco. But her world is turned upside down when her beloved grandfather, Max, reveals a startling secret: Anna is part of an aristocratic family who lost everything during World War II. What’s more, Max was forced to leave behind a precious item over seventy years ago in their estate in old Prussia. It’s now his ardent wish that Anna retrieve it.Anna burns with questions as she heads for Germany: What memento could be so important to her grandfather? And why did he keep their history hidden? As she searches for answers, she finds herself drawn to Wil, a man who may hold the key to unlock the mystery. Together they discover that her family’s secrets are linked with an abandoned apartment in Paris, and these secrets go deeper than she ever imagined.Alternating between 1930s Europe and the present, The House by the Lake illuminates the destiny of a family caught in the tumult of history. ...more|Historical Fiction|0|http://books.toscrape.com/media/cache/46/a2/46a2c968bfccf1979cc5576085eec6dd.jpg
http://books.toscrape.com/catalogue/mrs-houdini_821/index.html|a40723994f715420|Mrs. Houdini|30.25|30.25|15|A captivating debut novel, meticulously researched and beautifully imagined, about the passionate marriage of Harry and Bess Houdini—a love story that defied death itself.Before escape artist Harry Houdini died, he vowed he would find a way to speak to his beloved wife Bess from beyond the grave using a coded message known only to the two of them. When a widowed Bess begin A captivating debut novel, meticulously researched and beautifully imagined, about the passionate marriage of Harry and Bess Houdini—a love story that defied death itself.Before escape artist Harry Houdini died, he vowed he would find a way to speak to his beloved wife Bess from beyond the grave using a coded message known only to the two of them. When a widowed Bess begins seeing this code in seemingly impossible places, it becomes clear that Harry has an urgent message to convey. Unlocking the puzzle will set Bess on a course back through the pair’s extraordinary romance, which swept the illusionist and his bride from the beaches of Coney Island, to the palaces of Budapest, to the back lots of Hollywood. When the mystery finally leads Bess to the doorstep of a mysterious young photographer, she realizes that her husband’s magic may have been more than just illusion.In surprising turns that weave through the uncertain days of the dawn of the twentieth century and continue into the dazzling 1920s, Mrs. Houdini is a thrilling tale that will take you deep into the heart of one of history’s greatest love stories—asking what drives people to believe in something bigger than themselves—even as it reveals the famous magician’s most remarkable feat of all. ...more|Historical Fiction|0|http://books.toscrape.com/media/cache/b4/45/b445dbc81ca3aff1321a6bf0d0fa231d.jpg
http://books.toscrape.com/catalogue/the-marriage-of-opposites_759/index.html|52cf2a5933ec5d8f|The Marriage of Opposites|28.08|28.08|14|From the New York Times bestselling author of The Dovekeepers and The Museum of Extraordinary Things: a forbidden love story set on the tropical island of St. Thomas about the extraordinary woman who gave birth to painter Camille Pissarro; the Father of Impressionism.Growing up on idyllic St. Thomas in the early 1800s, Rachel dreams of life in faraway Paris. Rachel's mothe From the New York Times bestselling author of The Dovekeepers and The Museum of Extraordinary Things: a forbidden love story set on the tropical island of St. Thomas about the extraordinary woman who gave birth to painter Camille Pissarro; the Father of Impressionism.Growing up on idyllic St. Thomas in the early 1800s, Rachel dreams of life in faraway Paris. Rachel's mother, a pillar of their small refugee community of Jews who escaped the Inquisition, has never forgiven her daughter for being a difficult girl who refuses to live by the rules. Growing up, Rachel's salvation is their maid Adelle's belief in her strengths, and her deep, life-long friendship with Jestine, Adelle's daughter. But Rachel's life is not her own. She is married off to a widower with three children to save her father's business. When her husband dies suddenly and his handsome, much younger nephew, Fréderick, arrives from France to settle the estate, Rachel seizes her own life story, beginning a defiant, passionate love affair that sparks a scandal that affects all of her family, including her favorite son, who will become one of the greatest artists of France.Building on the triumphs of The Dovekeepers and The Museum of Extraordinary Things, set in a world of almost unimaginable beauty, The Marriage of Opposites showcases the beloved, bestselling Alice Hoffman at the height of her considerable powers. Once forgotten to history, the marriage of Rachel and Fréderick is a story that is as unforgettable as it is remarkable. ...more|Historical Fiction|0|http://books.toscrape.com/media/cache/33/8e/338e196723f3fb10d5c6990fe54be61d.jpg
http://books.toscrape.com/catalogue/glory-over-everything-beyond-the-kitchen-house_696/index.html|de4b403cb629a29f|Glory over Everything: Beyond The Kitchen House|45.84|45.84|14|From the author of the New York Times bestseller and beloved book club favorite The Kitchen House, a novel of family and long-buried secrets along the treacherous Underground Railroad.Jamie Pyke, son of both a slave and master of Tall Oakes, has a deadly secret that compels him to take a treacherous journey through the Underground Railroad.Published in 2010, The Kitchen Ho From the author of the New York Times bestseller and beloved book club favorite The Kitchen House, a novel of family and long-buried secrets along the treacherous Underground Railroad.Jamie Pyke, son of both a slave and master of Tall Oakes, has a deadly secret that compels him to take a treacherous journey through the Underground Railroad.Published in 2010, The Kitchen House became a grassroots bestseller. Fans connected so deeply to the book’s characters that the author, Kathleen Grissom, found herself being asked over and over “what happens next?” The wait is finally over.This new, stand-alone novel opens in 1830, and Jamie, who fled from the Virginian plantation he once called home, is passing in Philadelphia society as a wealthy white silversmith. After many years of striving, Jamie has achieved acclaim and security, only to discover that his aristocratic lover Caroline is pregnant. Before he can reveal his real identity to her, he learns that his beloved servant Pan has been captured and sold into slavery in the South. Pan’s father, to whom Jamie owes a great debt, pleads for Jamie’s help, and Jamie agrees, knowing the journey will take him perilously close to Tall Oakes and the ruthless slave hunter who is still searching for him. Meanwhile, Caroline’s father learns and exposes Jamie’s secret, and Jamie loses his home, his business, and finally Caroline.Heartbroken and with nothing to lose, Jamie embarks on a trip to a North Carolina plantation where Pan is being held with a former Tall Oakes slave named Sukey, who is intent on getting Pan to the Underground Railroad. Soon the three of them are running through the Great Dismal Swamp, the notoriously deadly hiding place for escaped slaves. Though they have help from those in the Underground Railroad, not all of them will make it out alive. ...more|Historical Fiction|0|http://books.toscrape.com/media/cache/06/ac/06ac98df817412ce2419c4509fa98c80.jpg
http://books.toscrape.com/catalogue/love-lies-and-spies_622/index.html|9546d537fbf99eb6|Love, Lies and Spies|20.55|20.55|12|Juliana Telford is not your average nineteenth-century young lady. She’s much more interested in researching ladybugs than marriage, fashionable dresses, or dances. So when her father sends her to London for a season, she’s determined not to form any attachments. Instead, she plans to secretly publish their research.Spencer Northam is not the average young gentleman of lei Juliana Telford is not your average nineteenth-century young lady. She’s much more interested in researching ladybugs than marriage, fashionable dresses, or dances. So when her father sends her to London for a season, she’s determined not to form any attachments. Instead, she plans to secretly publish their research.Spencer Northam is not the average young gentleman of leisure he appears. He is actually a spy for the War Office, and is more focused on acing his first mission than meeting eligible ladies. Fortunately, Juliana feels the same, and they agree to pretend to fall for each other. Spencer can finally focus, until he is tasked with observing Juliana’s traveling companions . . . and Juliana herself. ...more|Historical Fiction|0|http://books.toscrape.com/media/cache/5c/19/5c19785278eaa6bf984ce6659847abc3.jpg
